{
  "$schema": "https://json-schema.org/draft/2020-12/schema",
  "$id": "scenario.schema.json",
  "title": "PaxStressia scenario meta file (rules/scenarios/<id>/scenario.json)",
  "description": "Scenario metadata. A scenario directory may also contain nodes.json, edges.json, factions.json, events.json (each REPLACES the top-level file of the same name) and constants.json (a PARTIAL override merged over the top-level constants). Files absent from the scenario directory fall through to rules/.",
  "type": "object",
  "additionalProperties": false,
  "required": ["id", "name", "description", "seat"],
  "properties": {
    "id": { "type": "string", "pattern": "^[a-z0-9_]+$" },
    "name": { "type": "string", "minLength": 1 },
    "description": { "type": "string", "minLength": 1 },
    "seat": { "type": "string", "description": "Player seat for this scenario (e.g. France-analog)." },
    "notes": { "type": "string" },
    "sources": { "type": "array", "items": { "type": "string" } }
  }
}
